{"apiVersion":"contractor/v1alpha1","artifacts":{"source":{"name":"source","namespace":"inputs","revision":"019c-revision-1"}},"deadline":"2026-10-03T01:00:00Z","instructions":"Use the exact input and return the written revision.","objective":"Copy the source artifact","parameters":{"mode":"strict"},"resultArtifacts":{"report":{"name":"report","namespace":"builder"}},"subtaskId":"0"}
